name,category
わかばシューター,シューター
ボールドマーカー,シューター
ボールドマーカーネオ,シューター
ボールドマーカー7,シューター
もみじシューター,シューター
おちばシューター,シューター
シャープマーカー,シューター
シャープマーカーネオ,シューター
プロモデラーMG,シューター
プロモデラーRG,シューター
プロモデラーPG,シューター
スプラシューター,シューター
スプラシューターコラボ,シューター
スプラシューターベッチュー,シューター
.52ガロン,シューター
.52ガロンデコ,シューター
.52ガロンベッチュー,シューター
N-ZAP85,シューター
N-ZAP89,シューター
N-ZAP83,シューター
プライムシューター,シューター
プライムシューターコラボ,シューター
プライムシューターベッチュー,シューター
.96ガロン,シューター
.96ガロンデコ,シューター
ジェットスイーパー,シューター
ジャットスイーパーカスタム,シューター
ホットブラスター,ブラスター
ホットブラスターカスタム,ブラスター
ホットブラスターヒーロー,ブラスター
ノヴァブラスター,ブラスター
ノヴァブラスターネオ,ブラスター
ノヴァブラスターベッチュー,ブラスター
ロングブラスター,ブラスター
ロングブラスターカスタム,ブラスター
ロングブラスターネクロ,ブラスター
クラッシュブラスター,ブラスター
クラッシュブラスターネオ,ブラスター
ラピッドブラスター,ブラスター
ラピッドブラスターデコ,ブラスター
ラピッドブラスターベッチュー,ブラスター
Rブラスターエリート,ブラスター
Rブラスターエリートデコ,ブラスター
L3リールガン,リールガン
L3リールガンD,リールガン
L3リールガンベッチュー,リールガン
H3リールガン,リールガン
H3リールガンD,リールガン
H3リールガンチェリー,リールガン
ボトルガイザー,ボトルガイザー
ボトルガイザーフォイル,ボトルガイザー
スプラローラー,ローラー
スプラローラーコラボ,ローラー
スプラローラーベッチュー,ローラー
スプラローラーヒーロー,ローラー
カーボンローラー,ローラー
カーボンローラーデコ,ローラー
ヴァリアブルローラー,ローラー
ヴァリアブルローラーフォイル,ローラー
ダイナモローラー,ローラー
ダイナモローラーテスラ,ローラー
ダイナモローラーベッチュー,ローラー
パブロ,フデ
パブロ・ヒュー,フデ
パーマネント・パブロ,フデ
ホクサイ,フデ
ホクサイ・ヒュー,フデ
ホクサイベッチュー,フデ
スプラチャージャー,チャージャー
スプラスコープ,チャージャー
スプラチャージャーコラボ,チャージャー
スプラスコープコラボ,チャージャー
スプラチャージャーベッチュー,チャージャー
スプラスコープベッチュー,チャージャー
リッター4K,チャージャー
4Kスコープ,チャージャー
リッター4Kカスタム,チャージャー
4Kスコープカスタム,チャージャー
ソイチューバー,チャージャー
ソイチューバーカスタム,チャージャー
スクイックリンα,チャージャー
スクイックリンβ,チャージャー
スクイックリンγ,チャージャー
14式竹筒銃・甲,チャージャー
14式竹筒銃・乙,チャージャー
14式竹筒銃・丙,チャージャー
バケットスロッシャー,スロッシャー
バケットスロッシャーデコ,スロッシャー
バケットスロッシャーソーダ,スロッシャー
ヒッセン,スロッシャー
ヒッセン・ヒュー,スロッシャー
スクリュースロッシャー,スロッシャー
スクリュースロッシャーネオ,スロッシャー
スクリュースロッシャーベッチュー,スロッシャー
オーバーフロッシャー,スロッシャー
オーバーフロッシャーデコ,スロッシャー
エクスプロッシャー,スロッシャー
エクスプロッシャーカスタム,スロッシャー
バレルスピナー,スピナー
バレルスピナーデコ,スピナー
バレルスピナーリミックス,スピナー
スプラスピナー,スピナー
スプラスピナーコラボ,スピナー
スプラスピナーベッチュー,スピナー
ハイドラント,スピナー
ハイドラントカスタム,スピナー
クーゲルシュライバー,スピナー
クーゲルシュライバー・ヒュー,スピナー
ノーチラス47,スピナー
ノーチラス79,スピナー
スプラマニューバー,マニューバー
スプラマニューバーコラボ,マニューバー
スプラマニューバーベッチュー,マニューバー
スパッタリー,マニューバー
スパッタリー・ヒュー,マニューバー
スパッタリークリア,マニューバー
デュアルスイーパー,マニューバー
デュアルスイーパーカスタム,マニューバー
ケルビン525,マニューバー
ケルビン525デコ,マニューバー
ケルビン525ベッチュー,マニューバー
クアッドホッパーブラック,マニューバー
クアッドホッパーホワイト,マニューバー
パラシェルター,シェルター
パラシェルターソレーラ,シェルター
キャンピングシェルター,シェルター
キャンピングシェルターソレーラ,シェルター
キャンピングシェルターカーモ,シェルター
スパイガジェット,シェルター
スパイガジェットソレーラ,シェルター
スパイガジェットベッチュー,シェルター